{
  "$schema": "urn:artifact-passport:schema:0.7",
  "spec_version": "0.7",
  "passport_id": "example.intake.county-reference-demo",
  "artifact": {
    "name": "county-reference-demo",
    "version": "1.4.2",
    "kind": "application",
    "description": "A demonstration application for searching public county reference material.",
    "updated_at": "2026-09-11T00:00:00Z"
  },
  "intent": {
    "purpose": "Help residents find source-grounded public county information.",
    "audiences": [
      "Residents",
      "County staff",
      "Maintainers"
    ],
    "success_criteria": [
      "Supported searches return a relevant answer and source citation."
    ]
  },
  "operation": {
    "entry_points": [
      {
        "path": "index.html",
        "role": "Primary web application",
        "open_with": "Modern browser"
      }
    ],
    "environment": [
      "Modern browser",
      "Node.js for development"
    ],
    "network_policy": "forbidden",
    "network_notes": "The owner confirmed that the release must work locally without network access.",
    "dependencies": [
      {
        "name": "pdfjs-dist",
        "requirement": "4.10.38",
        "purpose": "Declared runtime dependency",
        "source": "package-lock.sample.json"
      },
      {
        "name": "react",
        "requirement": "19.2.0",
        "purpose": "Declared runtime dependency",
        "source": "package-lock.sample.json"
      }
    ]
  },
  "structure": {
    "source_of_truth": [
      {
        "path": "src/",
        "role": "Owner-confirmed canonical application source"
      }
    ],
    "generated_outputs": [
      {
        "path": "dist/",
        "role": "Owner-confirmed generated release"
      }
    ],
    "protected_items": [],
    "ignore": [
      "node_modules/"
    ]
  },
  "constraints": {
    "allowed_actions": [
      "Inspect and make owner-authorized changes."
    ],
    "must": [
      "Keep answers traceable to public source material."
    ],
    "must_not": [
      "Treat this passport as authority to exceed user or host permissions."
    ],
    "preserve": [
      "Offline operation and source citations."
    ],
    "data_classification": "public",
    "data_handling": {
      "may_leave_device": "yes",
      "approved_contexts": [
        "Owner-approved public and private tools"
      ],
      "redaction_required": false,
      "notes": "Follow owner and host authorization; the passport itself grants no disclosure permission."
    }
  },
  "procedures": {
    "setup": [
      "Install declared development dependencies only when authorized."
    ],
    "edit": [
      "Edit canonical files under src/."
    ],
    "build": [
      "Generate the release under dist/."
    ],
    "verify": [
      "Run supported and unsupported search checks offline."
    ],
    "release": [
      "Distribute the verified contents of dist/."
    ],
    "recovery": [
      "Restore the last verified release if required checks fail."
    ]
  },
  "verification": {
    "checks": [
      {
        "id": "offline-search",
        "description": "Open the release offline and run a representative supported search.",
        "method": "interaction",
        "expected": "The application returns a relevant result and source citation without network access.",
        "required": true
      }
    ]
  },
  "authority": {
    "owner": "Example project owner",
    "approvers": [
      "Example project owner"
    ],
    "change_policy": "The owner approves material behavior, content, and deployment changes."
  },
  "handoff": {
    "start_here": "Read ARTIFACT.md and this passport before modifying src/.",
    "safe_first_actions": [
      "Inventory files without modification.",
      "Confirm the current release passes its required check."
    ],
    "known_limitations": [
      "This is a non-operational example with fictional ownership."
    ],
    "open_questions": []
  },
  "intake": {
    "created_at": "2026-09-11T00:00:00Z",
    "mode": "folder",
    "detected_type": "Node package lockfile",
    "sources": [
      {
        "name": "county-reference-demo/",
        "media_type": "inode/directory",
        "size_bytes": 4096,
        "role": "Selected project folder"
      },
      {
        "name": "package-lock.sample.json",
        "media_type": "application/json",
        "size_bytes": 640,
        "role": "Intake evidence"
      }
    ],
    "observations": [
      {
        "field": "artifact.name",
        "status": "extracted",
        "value": "county-reference-demo",
        "source": "package-lock.sample.json"
      },
      {
        "field": "artifact.version",
        "status": "extracted",
        "value": "1.4.2",
        "source": "package-lock.sample.json"
      },
      {
        "field": "artifact.kind",
        "status": "inferred",
        "value": "application",
        "source": "package-lock.sample.json",
        "confidence": 0.78,
        "accepted": true
      },
      {
        "field": "authority",
        "status": "owner-required",
        "value": "Who owns and may approve material changes?",
        "accepted": true
      }
    ],
    "owner_questions": [],
    "notes": "Every inference and owner-required value was reviewed before export."
  },
  "review": {
    "status": "owner-reviewed",
    "reviewed_by": "Example project owner",
    "reviewed_at": "2026-09-13T00:00:00Z",
    "notes": "Example reviewed for the v0.7 specification."
  }
}
